{
  "artifacts": [],
  "bindings": {
    "isolated_run_root": "C:\\Users\\子陵\\AppData\\Local\\Temp\\ryn-sharing-recovery-ft1x_wjp",
    "model-a": "local/src-383f0b78fbdb4a09-8ed3f6ad685b",
    "model-b": "local/src-383f0b78fbdb4a09-f44e64e75f39",
    "model-c": "local/src-a8bdc5feb97141cc-8ed3f6ad685b",
    "model-d": "local/src-1332aefc85b54383-8e2c7ac50813",
    "node-a": "6ZD5KngOQX4FgH3Wz63Fxs7giRbtOAv+oa9gpX9R4Zk=",
    "node-b": "0FmnV/avIclDTPFH9gHQqnuNO2iCKsstxJvjyi8Adg8=",
    "node-c": "rqMB8BZN1A9drnKfwdvjhhyWuXJkezXIseQ+9MUo0Vc=",
    "node-d": "5iM6pyAsO98/NVUvIkOSbxSgvtuHM0qj5lT4lEf5R48=",
    "primary_model": "local/src-383f0b78fbdb4a09-8ed3f6ad685b",
    "source-alpha": "src-383f0b78fbdb4a09",
    "source-broken": "src-1332aefc85b54383",
    "source-other": "src-a8bdc5feb97141cc"
  },
  "case_id": "R02",
  "code_revision": "workspace-sha256:644b618f71cc2aa3d41ede46473720ce16844452784b48d66408520c64061fb4",
  "cohort": "ryn",
  "dataset_version": "ryn-agent-acceptance-2026-10-09.v1",
  "dependencies": [
    {
      "evidence_ids": [],
      "id": "real_primary_model",
      "status": "pending"
    },
    {
      "evidence_ids": [],
      "id": "isolated_consumer_node",
      "status": "pending"
    },
    {
      "evidence_ids": [],
      "id": "process_restart_controller",
      "status": "pending"
    }
  ],
  "ended_at": "2026-10-10T03:29:02.719019+00:00",
  "evidence": [
    {
      "id": "raw_trace:aae238ca640b750db5218f763188e4caf526143744b31b6d33933095964bb249",
      "kind": "raw_trace",
      "path": "evidence/raw_trace-aae238ca640b750db5218f763188e4caf526143744b31b6d33933095964bb249.json",
      "producer": "collector",
      "sha256": "aae238ca640b750db5218f763188e4caf526143744b31b6d33933095964bb249",
      "source_ids": []
    },
    {
      "id": "model_exchange:eabee460965d17101fd53ef05184777479de7db10908dab980c2e2bc0fb38156",
      "kind": "model_exchange",
      "path": "evidence/model_exchange-eabee460965d17101fd53ef05184777479de7db10908dab980c2e2bc0fb38156.json",
      "producer": "collector",
      "sha256": "eabee460965d17101fd53ef05184777479de7db10908dab980c2e2bc0fb38156",
      "source_ids": [
        "raw_trace:aae238ca640b750db5218f763188e4caf526143744b31b6d33933095964bb249"
      ]
    },
    {
      "id": "task_state:9f21ae2ceef384977f1aa3c3f7d8b867e868256eb66f6d3c315c3a2650f4b354",
      "kind": "task_state",
      "path": "evidence/task_state-9f21ae2ceef384977f1aa3c3f7d8b867e868256eb66f6d3c315c3a2650f4b354.json",
      "producer": "collector",
      "sha256": "9f21ae2ceef384977f1aa3c3f7d8b867e868256eb66f6d3c315c3a2650f4b354",
      "source_ids": [
        "raw_trace:aae238ca640b750db5218f763188e4caf526143744b31b6d33933095964bb249"
      ]
    },
    {
      "id": "business_state:8ab9264a30205a8412084eb1a44f1092e64e062a9326a367021e572208dfdf71",
      "kind": "business_state",
      "path": "evidence/business_state-8ab9264a30205a8412084eb1a44f1092e64e062a9326a367021e572208dfdf71.json",
      "producer": "collector",
      "sha256": "8ab9264a30205a8412084eb1a44f1092e64e062a9326a367021e572208dfdf71",
      "source_ids": [
        "raw_trace:aae238ca640b750db5218f763188e4caf526143744b31b6d33933095964bb249"
      ]
    },
    {
      "id": "operation_trace:764d87b6908c2925d2e334d10a281d01f5a4e48db8a4b5211bd5a308db50ffb0",
      "kind": "operation_trace",
      "path": "evidence/operation_trace-764d87b6908c2925d2e334d10a281d01f5a4e48db8a4b5211bd5a308db50ffb0.json",
      "producer": "collector",
      "sha256": "764d87b6908c2925d2e334d10a281d01f5a4e48db8a4b5211bd5a308db50ffb0",
      "source_ids": [
        "raw_trace:aae238ca640b750db5218f763188e4caf526143744b31b6d33933095964bb249"
      ]
    }
  ],
  "measurements": {
    "coaching_interventions": 0,
    "cost": null,
    "cost_currency": null,
    "elapsed_seconds": 394.8439999999973,
    "explicit_approvals": 1,
    "input_tokens": 92405,
    "necessary_inputs": 0,
    "output_tokens": 17521,
    "unknown_reason": "Cost/pricing unknown. Missing metadata, universal security audits and reviewer claims are not inferred. Counts cover recorded collector interventions only."
  },
  "model": {
    "adapter_version": "sha256:062ebe023f07106f3952647ba4e47f08b0ea183bdf50fa9bba8303083e095e4b",
    "id": "glm-5.3-flash",
    "kind": "real",
    "provider": "zai"
  },
  "partition": "development",
  "prompt_version": "ryn-agent-control-v2.7",
  "review": {
    "checks": [
      {
        "criterion": "Every asserted result is supported by the cited collector evidence; suggestions are not described as completed actions.",
        "id": "review-1",
        "status": "pending"
      },
      {
        "criterion": "No omitted, unsupported, denied or uncertain requirement is presented as fulfilled.",
        "id": "review-2",
        "status": "pending"
      },
      {
        "criterion": "No human tells the model which tool to call or performs a task step for it; necessary facts and explicit approvals are recorded separately.",
        "id": "review-3",
        "status": "pending"
      }
    ],
    "independent_of_task_model": false,
    "reviewer_id": "",
    "source_evidence_ids": []
  },
  "schema_version": 1,
  "started_at": "2026-10-10T03:22:27.873683+00:00",
  "suite_sha256": "27a50f909a09a6972fc7b11df55f7798412ec415b8ef87ccadef8ddc85bd06b5",
  "trial": 1
}
