{
  "artifacts": [],
  "bindings": {
    "docs-alpha": "32e5196896a84f6da03a64f8e3ba58dd",
    "docs-beta": "c5cffa9a992e42c38149b5793a82c088",
    "isolated_run_root": "C:\\Users\\子陵\\AppData\\Local\\Temp\\ryn-document-live-5xyg7ov_",
    "primary_model": "local/src-e7811b78460e4967-0d8724178b09"
  },
  "case_id": "P02",
  "code_revision": "workspace-sha256:8c19f113ca485818899cf49ee6b7fa2d1a8c31929b79dc064213df2a670b19b5",
  "cohort": "ryn",
  "dataset_version": "ryn-agent-acceptance-2026-10-09.v1",
  "dependencies": [
    {
      "evidence_ids": [],
      "id": "real_primary_model",
      "status": "pending"
    },
    {
      "evidence_ids": [],
      "id": "isolated_consumer_node",
      "status": "pending"
    }
  ],
  "ended_at": "2026-10-09T14:53:00.977489+00:00",
  "evidence": [
    {
      "id": "raw_trace:0f8546903b1be6830684d407c890d069274190d40f6c6e32094ac55eebb3f540",
      "kind": "raw_trace",
      "path": "evidence/raw_trace-0f8546903b1be6830684d407c890d069274190d40f6c6e32094ac55eebb3f540.json",
      "producer": "collector",
      "sha256": "0f8546903b1be6830684d407c890d069274190d40f6c6e32094ac55eebb3f540",
      "source_ids": []
    },
    {
      "id": "model_exchange:6caf0ecfb1babce6250eb55da6cf51257b591474cbfa55dae49128b43a69bdec",
      "kind": "model_exchange",
      "path": "evidence/model_exchange-6caf0ecfb1babce6250eb55da6cf51257b591474cbfa55dae49128b43a69bdec.json",
      "producer": "collector",
      "sha256": "6caf0ecfb1babce6250eb55da6cf51257b591474cbfa55dae49128b43a69bdec",
      "source_ids": [
        "raw_trace:0f8546903b1be6830684d407c890d069274190d40f6c6e32094ac55eebb3f540"
      ]
    },
    {
      "id": "task_state:d6381f21d61b616b850c3406425ef190821d2b505f06cf78bdff221ddbdb59df",
      "kind": "task_state",
      "path": "evidence/task_state-d6381f21d61b616b850c3406425ef190821d2b505f06cf78bdff221ddbdb59df.json",
      "producer": "collector",
      "sha256": "d6381f21d61b616b850c3406425ef190821d2b505f06cf78bdff221ddbdb59df",
      "source_ids": [
        "raw_trace:0f8546903b1be6830684d407c890d069274190d40f6c6e32094ac55eebb3f540"
      ]
    },
    {
      "id": "business_state:452d9fb3b480a9ffd97b46a499a9c07ed9e9d8f2ff321f791f26dd3cc2d1a2b8",
      "kind": "business_state",
      "path": "evidence/business_state-452d9fb3b480a9ffd97b46a499a9c07ed9e9d8f2ff321f791f26dd3cc2d1a2b8.json",
      "producer": "collector",
      "sha256": "452d9fb3b480a9ffd97b46a499a9c07ed9e9d8f2ff321f791f26dd3cc2d1a2b8",
      "source_ids": [
        "raw_trace:0f8546903b1be6830684d407c890d069274190d40f6c6e32094ac55eebb3f540"
      ]
    },
    {
      "id": "operation_trace:c56bbd7402e4ba32cbd062794bb904f66039ffcba9ca0ea9be60e412efd335a5",
      "kind": "operation_trace",
      "path": "evidence/operation_trace-c56bbd7402e4ba32cbd062794bb904f66039ffcba9ca0ea9be60e412efd335a5.json",
      "producer": "collector",
      "sha256": "c56bbd7402e4ba32cbd062794bb904f66039ffcba9ca0ea9be60e412efd335a5",
      "source_ids": [
        "raw_trace:0f8546903b1be6830684d407c890d069274190d40f6c6e32094ac55eebb3f540"
      ]
    }
  ],
  "measurements": {
    "coaching_interventions": 0,
    "cost": null,
    "cost_currency": null,
    "elapsed_seconds": 71.375,
    "explicit_approvals": 0,
    "input_tokens": 23837,
    "necessary_inputs": 0,
    "output_tokens": 2895,
    "unknown_reason": "Cost/pricing unknown. Missing metadata, universal security audits and reviewer claims are not inferred. Counts cover recorded collector interventions only."
  },
  "model": {
    "adapter_version": "sha256:062ebe023f07106f3952647ba4e47f08b0ea183bdf50fa9bba8303083e095e4b",
    "id": "glm-5.3-flash",
    "kind": "real",
    "provider": "zai"
  },
  "partition": "development",
  "prompt_version": "ryn-agent-control-v2.5",
  "review": {
    "checks": [
      {
        "criterion": "Every asserted result is supported by the cited collector evidence; suggestions are not described as completed actions.",
        "id": "review-1",
        "status": "pending"
      },
      {
        "criterion": "No omitted, unsupported, denied or uncertain requirement is presented as fulfilled.",
        "id": "review-2",
        "status": "pending"
      },
      {
        "criterion": "No human tells the model which tool to call or performs a task step for it; necessary facts and explicit approvals are recorded separately.",
        "id": "review-3",
        "status": "pending"
      }
    ],
    "independent_of_task_model": false,
    "reviewer_id": "",
    "source_evidence_ids": []
  },
  "schema_version": 1,
  "started_at": "2026-10-09T14:51:49.601910+00:00",
  "suite_sha256": "27a50f909a09a6972fc7b11df55f7798412ec415b8ef87ccadef8ddc85bd06b5",
  "trial": 1
}
